{
  "schedule": "enso_monthly",
  "family": "noaa_climate",
  "wave": 1,
  "cron": "cron(0 12 5 * ? *)",
  "publish_class": "A",
  "retrofit_required": false,
  "retrofit_landed": true,
  "promote_mode": "autonomous",
  "auth_mode": "kms",
  "skip_existing": false,
  "asof": "<aws.scheduler.scheduled-time>",
  "gate_tables": [
    "silver_noaa_iod",
    "silver_noaa_oni"
  ],
  "gate_baseline_uri": "s3://leviathan-dev-shahem-001/cascade_census/rolling/enso_monthly/census.json",
  "gate_jobdef": "leviathan-dev-silver-gate",
  "gate_queue": "leviathan-dev-queue-ondemand",
  "shared_silver_jobdef": "leviathan-dev-b3-flat-silver",
  "retry": {
    "maximum_retry_attempts": 3,
    "maximum_event_age_in_seconds": 86400
  },
  "queue": "leviathan-dev-queue-ondemand",
  "chain_shape": "2 indep chains: oni fetch(+ENSO vintage capture)->silver(latest-only + vintages), iod fetch->silver",
  "phases": [
    {
      "name": "fetch",
      "tasks": [
        {
          "id": "fetch_noaa_oni",
          "invocation_form": "s",
          "integration": "batch",
          "jobdef": "leviathan-dev-b3-flat-silver",
          "queue": "leviathan-dev-queue-ondemand",
          "command": [
            "jobs/ingest/fetch_noaa_oni.py"
          ],
          "env": {},
          "publishes": false
        },
        {
          "id": "fetch_cpc_iodmi",
          "invocation_form": "s",
          "integration": "batch",
          "jobdef": "leviathan-dev-b3-flat-silver",
          "queue": "leviathan-dev-queue-ondemand",
          "command": [
            "jobs/ingest/fetch_cpc_iodmi.py"
          ],
          "env": {},
          "publishes": false
        }
      ]
    },
    {
      "name": "silver",
      "tasks": [
        {
          "id": "noaa_oni",
          "invocation_form": "s",
          "integration": "batch",
          "jobdef": "leviathan-dev-b3-flat-silver",
          "queue": "leviathan-dev-queue-ondemand",
          "command": [
            "jobs/batch/noaa_oni_task.py"
          ],
          "env": {},
          "publishes": true,
          "publish_mode": "shadow_canonical"
        },
        {
          "id": "noaa_enso_vintages",
          "invocation_form": "s",
          "integration": "batch",
          "jobdef": "leviathan-dev-b3-flat-silver",
          "queue": "leviathan-dev-queue-ondemand",
          "command": [
            "jobs/batch/noaa_oni_task.py",
            "--table",
            "silver_noaa_enso_vintages"
          ],
          "env": {},
          "publishes": true,
          "publish_mode": "shadow_canonical"
        },
        {
          "id": "noaa_iod",
          "invocation_form": "m",
          "integration": "batch",
          "jobdef": "leviathan-dev-b3-flat-silver",
          "queue": "leviathan-dev-queue-ondemand",
          "command": [
            "-m",
            "jobs.batch.noaa_iod_task",
            "--source",
            "cpc_iodmi",
            "--force-overwrite"
          ],
          "env": {},
          "publishes": true,
          "publish_mode": "shadow_canonical"
        }
      ]
    }
  ],
  "notes": "Two independent single-source chains (oni + iod). noaa_iod_task is module form [m]. IOD RE-BASELINED 2026-07-25 (docs/private/ADR_IOD_SOURCE_SWITCH.md, Option B) from the NOAA PSL HadISST DMI -- frozen upstream since 2025-06-16, last real observation 2025-04 -- to the NOAA CPC IODMI (ERSSTv5, fixed 1991-2020 climatology), a LIVE monthly series from 1950-01 with ~1 month publication lag. The served identity is unchanged (same silver_noaa_iod table, same 8-column schema, same silver key); only the basis, the raw/bronze capture prefixes and the source stamp move. FETCH leg is jobs/ingest/fetch_cpc_iodmi.py; jobs/ingest/fetch_noaa_iod.py stays TRACKED but off-schedule (it captures the HadISST series for the immutable silver/_frozen/noaa_iod_hadisst/ provenance snapshot; rollback = repoint to it). The silver AND promote legs MUST carry --source cpc_iodmi (the task still DEFAULTS to the legacy noaa_iod basis) plus --force-overwrite: jobs/batch/noaa_iod_task.py early-returns on an existing canonical object BEFORE the publish guard runs, so without the flag both the shadow silver leg and the canonical promote are silent no-ops, canonical LastModified freezes, and the noaa_climate FreshnessLagDays alarm (statistic=Maximum -- it reads the STALEST family member) goes red ~45 days out and stays red. --force-overwrite is the only lever the task exposes (there is no --skip-existing toggle) and it is honest here: silver_noaa_iod is a FLAT single-object full-refresh table rebuilt from the whole upstream file every run, so a re-run republishes a superset-or-equal snapshot rather than a partial one; the flag bypasses ONLY the exists-check, never the publish guard (canonical still needs the KMS-signed approval) and never the shadow-first validation -- the HARD gates (sys.exit(1)) are rows >= 900 and iod_dmi_3month_avg non-null >= 890, then the publisher's registry non-null floors, so a truncated upstream exits 1 before anything reaches canonical. NOTE the 1997-11 event band is WARN-ONLY: noaa_iod_task.py logs a warning and CONTINUES when the value falls outside 1.00-1.20 (and likewise when the 1997-11 row is absent entirely), so it is a sanity signal, NOT a gate -- an upstream basis swap or silent re-climatology that kept the row count would republish canonical with only a log line. Promote it to an exit if CPC ever restates the record. Residual, disclosed: the row floor is 900 against a 918-row 2026-06 vintage, so an upstream truncation that still cleared 900 would republish a shorter series; tighten the floor if CPC ever revises the record start. FRESHNESS: silver_noaa_iod now carries freshness_sla cadence=monthly max_lag_days=45 (publication_lag_days deliberately null) and is a full member of the noaa_climate family freshness alarm -- the pre-switch 'liveness-only poll, no per-IOD freshness alarm, enso not gated on iod freshness' note is OBSOLETE and the liveness_only_tables entry is dropped. ENSO VINTAGES (data repairs 0929, lane ENSO): NOAA made the RELATIVE ONI its official ENSO index from 2026-02-01 (NWS PNS 26-05) and rewrites both files in place, restating history. The oni FETCH leg now also banks BOTH files (legacy oni.ascii.txt and RONI.ascii.txt), never overwriting, under raw/weather/source=noaa_cpc_enso_captures/ keyed by NOAA's Last-Modified and the content digest; a capture failure is logged ENSO_CAPTURE_FAILED and never fails the leg. A SECOND oni silver task, noaa_enso_vintages (noaa_oni_task.py --table silver_noaa_enso_vintages), rebuilds the sibling table silver_noaa_enso_vintages (one row per index x season x distinct published value, known date = vintage_date, official_from/official_until from the publisher's statement) from the banked captures only; it never fetches and never writes raw/bronze, and silver_noaa_oni is untouched. gate_tables gains it in ARM 2 (a later render, applied only after the table's first canonical publish and its Glue registration -- the gate reds on an absent table; this ARM 1 render carries the task alone); select_branch routes it to BRANCH_B (no PG_MIRROR_TABLES entry, consumers feature_layer) -- the silver_pink_sheet_vintages precedent. ORDER: the table's F010 contract (integrator, generated) and one owner-run seed + first publish land BEFORE this descriptor is rendered and applied, or the gate reds on an unregistered or absent table. CADENCE RISK (reported, not changed here): NOAA updated both files on 2026-09-03; a monthly capture on the 5th misses a vintage whenever NOAA updates after the 5th and again before the next 5th."
}
